"","Name","Author","User Rating","Reviews","Price","Year","Genre"
"501","Thug Kitchen: The Official Cookbook: Eat Like You Give a F*ck (Thug Kitchen Cookbooks)","Thug Kitchen",4.6,11128,23,2014,"Non Fiction"
"502","Thug Kitchen: The Official Cookbook: Eat Like You Give a F*ck (Thug Kitchen Cookbooks)","Thug Kitchen",4.6,11128,23,2015,"Non Fiction"
"503","Thug Kitchen: The Official Cookbook: Eat Like You Give a F*ck (Thug Kitchen Cookbooks)","Thug Kitchen",4.6,11128,23,2016,"Non Fiction"
"504","Thug Kitchen: The Official Cookbook: Eat Like You Give a F*ck (Thug Kitchen Cookbooks)","Thug Kitchen",4.6,11128,23,2017,"Non Fiction"
"505","Tina Fey: Bossypants","Tina Fey",4.3,5977,12,2011,"Non Fiction"
"506","To Kill a Mockingbird","Harper Lee",4.8,26234,0,2013,"Fiction"
"507","To Kill a Mockingbird","Harper Lee",4.8,26234,0,2014,"Fiction"
"508","To Kill a Mockingbird","Harper Lee",4.8,26234,0,2015,"Fiction"
"509","To Kill a Mockingbird","Harper Lee",4.8,26234,0,2016,"Fiction"
"510","To Kill a Mockingbird","Harper Lee",4.8,26234,7,2019,"Fiction"
"511","Tools of Titans: The Tactics, Routines, and Habits of Billionaires, Icons, and World-Class Performers","Timothy Ferriss",4.6,4360,21,2017,"Non Fiction"
"512","Towers of Midnight (Wheel of Time, Book Thirteen)","Robert Jordan",4.8,2282,21,2010,"Fiction"
"513","True Compass: A Memoir","Edward M. Kennedy",4.5,438,15,2009,"Non Fiction"
"514","Twilight (The Twilight Saga, Book 1)","Stephenie Meyer",4.7,11676,9,2009,"Fiction"
"515","Ultimate Sticker Book: Frozen: More Than 60 Reusable Full-Color Stickers","DK",4.5,2586,5,2014,"Fiction"
"516","Unbroken: A World War II Story of Survival, Resilience, and Redemption","Laura Hillenbrand",4.8,29673,16,2010,"Non Fiction"
"517","Unbroken: A World War II Story of Survival, Resilience, and Redemption","Laura Hillenbrand",4.8,29673,16,2011,"Non Fiction"
"518","Unbroken: A World War II Story of Survival, Resilience, and Redemption","Laura Hillenbrand",4.8,29673,16,2012,"Non Fiction"
"519","Unbroken: A World War II Story of Survival, Resilience, and Redemption","Laura Hillenbrand",4.8,29673,13,2014,"Non Fiction"
"520","Unbroken: A World War II Story of Survival, Resilience, and Redemption","Laura Hillenbrand",4.8,29673,16,2014,"Non Fiction"
"521","Under the Dome: A Novel","Stephen King",4.3,6740,20,2009,"Fiction"
"522","Unfreedom of the Press","Mark R. Levin",4.9,5956,11,2019,"Non Fiction"
"523","Unicorn Coloring Book: For Kids Ages 4-8 (US Edition) (Silly Bear Coloring Books)","Silly Bear",4.8,6108,4,2019,"Non Fiction"
"524","Uninvited: Living Loved When You Feel Less Than, Left Out, and Lonely","Lysa TerKeurst",4.7,4585,9,2016,"Non Fiction"
"525","Watchmen","Alan Moore",4.8,3829,42,2009,"Fiction"
"526","Water for Elephants: A Novel","Sara Gruen",4.5,8958,12,2011,"Fiction"
"527","What Happened","Hillary Rodham Clinton",4.6,5492,18,2017,"Non Fiction"
"528","What If?: Serious Scientific Answers to Absurd Hypothetical Questions","Randall Munroe",4.7,9292,17,2014,"Non Fiction"
"529","What Pet Should I Get? (Classic Seuss)","Dr. Seuss",4.7,1873,14,2015,"Fiction"
"530","What Should Danny Do? (The Power to Choose Series)","Adir Levy",4.8,8170,13,2019,"Fiction"
"531","What to Expect When You're Expecting","Heidi Murkoff",4.4,3341,9,2011,"Non Fiction"
"532","Wheat Belly: Lose the Wheat, Lose the Weight, and Find Your Path Back to Health","William Davis",4.4,7497,6,2012,"Non Fiction"
"533","Wheat Belly: Lose the Wheat, Lose the Weight, and Find Your Path Back to Health","William Davis",4.4,7497,6,2013,"Non Fiction"
"534","When Breath Becomes Air","Paul Kalanithi",4.8,13779,14,2016,"Non Fiction"
"535","Where the Crawdads Sing","Delia Owens",4.8,87841,15,2019,"Fiction"
"536","Where the Wild Things Are","Maurice Sendak",4.8,9967,13,2009,"Fiction"
"537","Whose Boat Is This Boat?: Comments That Don't Help in the Aftermath of a Hurricane","The Staff of The Late Show with<U+0085>",4.6,6669,12,2018,"Non Fiction"
"538","Wild: From Lost to Found on the Pacific Crest Trail","Cheryl Strayed",4.4,17044,18,2012,"Non Fiction"
"539","Winter of the World: Book Two of the Century Trilogy","Ken Follett",4.5,10760,15,2012,"Fiction"
"540","Women Food and God: An Unexpected Path to Almost Everything","Geneen Roth",4.2,1302,11,2010,"Non Fiction"
"541","Wonder","R. J. Palacio",4.8,21625,9,2013,"Fiction"
"542","Wonder","R. J. Palacio",4.8,21625,9,2014,"Fiction"
"543","Wonder","R. J. Palacio",4.8,21625,9,2015,"Fiction"
"544","Wonder","R. J. Palacio",4.8,21625,9,2016,"Fiction"
"545","Wonder","R. J. Palacio",4.8,21625,9,2017,"Fiction"
"546","Wrecking Ball (Diary of a Wimpy Kid Book 14)","Jeff Kinney",4.9,9413,8,2019,"Fiction"
"547","You Are a Badass: How to Stop Doubting Your Greatness and Start Living an Awesome Life","Jen Sincero",4.7,14331,8,2016,"Non Fiction"
"548","You Are a Badass: How to Stop Doubting Your Greatness and Start Living an Awesome Life","Jen Sincero",4.7,14331,8,2017,"Non Fiction"
"549","You Are a Badass: How to Stop Doubting Your Greatness and Start Living an Awesome Life","Jen Sincero",4.7,14331,8,2018,"Non Fiction"
"550","You Are a Badass: How to Stop Doubting Your Greatness and Start Living an Awesome Life","Jen Sincero",4.7,14331,8,2019,"Non Fiction"
